{
  "iteration": 6,
  "work_unit": "mobile portrait-led character blueprint forge",
  "status": "completion_candidate",
  "changed_files": [
    "project-a/game/scripts/ui/blueprint_screen.gd",
    "project-a/scripts/slg_main.gd",
    "project-a/tools/run_blueprint_screen_tests.gd"
  ],
  "evidence_ids": [
    "ev_blueprint_forge_runtime_4336f06",
    "ev_blueprint_forge_responsive_4336f06",
    "ev_blueprint_forge_visual_runtime_4336f06",
    "ev_blueprint_forge_visual_critic_4336f06",
    "ev_ui_blueprint_integration_runtime_4336f06",
    "ev_ui_blueprint_integration_responsive_4336f06"
  ],
  "resolved_findings": [],
  "new_findings": [],
  "failed_checks": [],
  "rejected_approaches": [
    "repeated ability-icon prerequisite tree with no character portrait",
    "same action hierarchy for available, ready and locked states",
    "large copy blocks that displace the permanent-character reward",
    "textured buttons whose corner details resemble editor handles"
  ],
  "next_action": "Close the accepted blueprint forge unit, preserve its gates, then author the next highest-value mobile home-screen challenge scenario.",
  "blocker": null,
  "schema_version": "caesar-loop/v2",
  "run_id": "ui_ux_gauntlet_20260731"
}
