{
  "iteration": 7,
  "work_unit": "mobile objective action compass",
  "status": "completion_candidate",
  "changed_files": [
    "project-a/game/scenes/screens/goals_screen.tscn",
    "project-a/game/scripts/ui/goals_screen.gd",
    "project-a/tools/capture_action_compass_scenario.gd"
  ],
  "evidence_ids": [
    "ev_action_compass_runtime_07e7e65",
    "ev_action_compass_responsive_07e7e65",
    "ev_action_compass_visual_runtime_07e7e65",
    "ev_action_compass_visual_critic_07e7e65",
    "ev_ui_action_integration_runtime_07e7e65",
    "ev_ui_action_integration_responsive_07e7e65"
  ],
  "resolved_findings": [],
  "new_findings": [],
  "failed_checks": [],
  "rejected_approaches": [
    "three equally weighted route nodes plus a fourth CTA",
    "two disabled reward buttons styled like active choices",
    "long hurdle and recovery copy in the primary path",
    "shipping active and mission-locked fixtures with identical state data"
  ],
  "next_action": "Close the accepted action compass unit and continue the active mobile UI/UX challenge with the next unfrozen screen gap.",
  "blocker": null,
  "schema_version": "caesar-loop/v2",
  "run_id": "ui_ux_gauntlet_20260731"
}
