{
  "schema_version": "caesar-loop/v2",
  "run_id": "ui_ux_gauntlet_20260731",
  "iteration": 14,
  "work_unit": "mobile chapter victory hero tableau",
  "status": "completion_candidate",
  "changed_files": [
    "project-a/game/scripts/ui/battle_result_screen.gd",
    "project-a/game/scripts/ui/goals_screen.gd",
    "project-a/scripts/slg_main.gd",
    "project-a/tools/capture_chapter_victory_tableau_scenario.gd",
    "project-a/tools/run_chapter_one_completion_tests.gd"
  ],
  "evidence_ids": [
    "ev_chapter_victory_runtime_e8d6596",
    "ev_chapter_victory_responsive_e8d6596",
    "ev_chapter_victory_visual_runtime_e8d6596",
    "ev_chapter_victory_visual_critic_e8d6596"
  ],
  "resolved_findings": [],
  "new_findings": [],
  "failed_checks": [],
  "rejected_approaches": [
    "Judging the stale text-report artifact as current shipping UI.",
    "Accepting a malformed 3840x1886 capture labeled 844x390.",
    "Keeping the chapter welfare chain as hidden semantic buttons."
  ],
  "next_action": "Close the accepted chapter-victory unit and run the shared mobile UI integration checkpoint.",
  "blocker": null
}
