{
  "schema_version": "caesar-loop/v2",
  "run_id": "mobile_slg_ui_refresh_20260730",
  "iteration": 4,
  "work_unit": "把体验设置和本地数据从竞争式双栏表单重构为渐进披露分区",
  "status": "progress",
  "changed_files": [
    "project-a/game/scenes/screens/settings_screen.tscn",
    "project-a/game/scripts/ui/settings_screen.gd",
    "project-a/tools/capture_ui_review.gd",
    "project-a/tools/run_settings_screen_tests.gd",
    "project-a/tools/run_ui_smoke_tests.gd",
    "project-a/artifacts/ui-settings-844x390.png",
    "project-a/artifacts/ui-settings-storage-844x390.png",
    "project-a/artifacts/ui-settings-playtest-844x390.png"
  ],
  "evidence_ids": [
    "ev_ui_runtime_df6c4f3",
    "ev_ui_responsive_df6c4f3",
    "ev_ui_visual_df6c4f3",
    "ev_ui_human_required_df6c4f3"
  ],
  "resolved_findings": [],
  "new_findings": [],
  "failed_checks": [
    "首个候选保留重复分区标题，使自动技能和试玩报告动作掉出首屏；已移除重复标题并降低诊断状态的文字层级。"
  ],
  "rejected_approaches": [
    "不再让常用体验设置与危险存档操作同时竞争注意力。",
    "不让诊断状态文案优先于下载和清空动作。"
  ],
  "next_action": "审查并收敛研究树、招募结果和战斗结算等仍偏后台卡片的页面。",
  "blocker": null
}
