{
  "schema_version": "caesar-loop/v2",
  "run_id": "ui_ux_gauntlet_20260731",
  "iteration": 22,
  "work_unit": "war-zone player learning human handoff",
  "status": "completion_candidate",
  "changed_files": [
    "docs/workbench/validation-specs/war-zone-exploration-learning-20260801.json"
  ],
  "evidence_ids": [
    "ev_player_learning_human_required_ee79abe"
  ],
  "resolved_findings": [],
  "new_findings": [],
  "failed_checks": [],
  "rejected_approaches": [
    "Ask the player to fill goal/risk/action tables.",
    "Use six unrelated screens in one validation.",
    "Pass player learning from an AI critic score.",
    "Request human review while known automated or visual blockers remain."
  ],
  "next_action": "Collect fresh-player responses through the running Workbench service, then review every raw session before creating acceptance evidence.",
  "blocker": null
}
