{
  "iteration": 9,
  "work_unit": "mobile first growth duel",
  "status": "completion_candidate",
  "changed_files": [
    "project-a/project.godot",
    "project-a/assets/ui/recruit/faction-armored-v2.webp",
    "project-a/game/scripts/ui/legion_screen.gd",
    "project-a/tools/capture_first_growth_duel_scenario.gd",
    "project-a/tools/run_first_growth_flow_tests.gd"
  ],
  "evidence_ids": [
    "ev_growth_duel_runtime_7626daf",
    "ev_growth_duel_responsive_7626daf",
    "ev_growth_duel_visual_runtime_7626daf",
    "ev_growth_duel_visual_critic_7626daf"
  ],
  "resolved_findings": [],
  "new_findings": [],
  "failed_checks": [],
  "rejected_approaches": [
    "two dense text stat cards without character art",
    "disabled gray buttons with repeated red explanation",
    "text-only boss-ready report",
    "shipping an asymmetric old armored render after the first visual pass",
    "forcing desktop preview to scale an 844x390 window"
  ],
  "next_action": "Integrate the accepted growth duel and continue the active mobile UI/UX challenge.",
  "blocker": null,
  "schema_version": "caesar-loop/v2",
  "run_id": "ui_ux_gauntlet_20260731"
}
