{
  "schema_version": "caesar-loop/v2",
  "run_id": "ui_ux_gauntlet_20260731",
  "iteration": 2,
  "work_unit": "factory world-first HUD and contextual construction flow",
  "status": "completion_candidate",
  "changed_files": [
    "project-a/game/scenes/screens/factory_screen.tscn",
    "project-a/game/scripts/ui/factory_screen.gd",
    "project-a/scripts/slg_main.gd",
    "project-a/assets/ui/icons/factory/factory-facility-v1.png",
    "project-a/assets/ui/icons/factory/factory-build-v1.png",
    "project-a/tools/run_factory_screen_tests.gd",
    "project-a/tools/capture_factory_hud_scenario.gd",
    "project-a/tools/run_ui_smoke_tests.gd"
  ],
  "evidence_ids": [
    "ev_factory_runtime_2e23dd4",
    "ev_factory_responsive_2e23dd4",
    "ev_factory_visual_runtime_2e23dd4",
    "ev_factory_visual_critic_2e23dd4"
  ],
  "resolved_findings": [
    "finding_factory_hud_identity_001"
  ],
  "new_findings": [],
  "failed_checks": [],
  "rejected_approaches": [
    "generic text tool buttons and persistent dashboard framing",
    "a neutral central world that could not express toilet-resistance identity",
    "a white box silhouette that read as a block person instead of a toilet commander"
  ],
  "next_action": "Expose this accepted factory slice through the simple browser question-and-feedback Workbench route.",
  "blocker": null
}
